{
  "schema_version": "v1",
  "response_type": "procedure_workflow",
  "product_boundary": "evidence_and_procedure_only",
  "procedure_id": "cccccccc-cccc-4ccc-8ccc-cccccccccccc",
  "workflow_id": "dddddddd-dddd-4ddd-8ddd-dddddddddddd",
  "workflow_version": "1.0.0",
  "tenant_id": "11111111-1111-4111-8111-111111111111",
  "request_id": "22222222-2222-4222-8222-222222222222",
  "title": "Borrador documental para una solicitud comunitaria de agua",
  "jurisdiction": "Municipio de La Antigua Guatemala, Sacatepéquez, Guatemala",
  "authority_status": "official_national",
  "approval_status": "draft",
  "steps": [
    {
      "step_id": "eeeeeeee-eeee-4eee-8eee-eeeeeeeeeeee",
      "sequence": 1,
      "action": "Documentar la necesidad comunitaria y localizar la regla municipal aplicable.",
      "responsible_actor": null,
      "responsible_unit": null,
      "preconditions": [
        "La comunidad está identificada."
      ],
      "required_documents": [
        {
          "document_requirement_id": "ffffffff-ffff-4fff-8fff-ffffffffffff",
          "name": "Solicitud comunitaria respaldada documentalmente",
          "evidence_status": "missing_evidence",
          "citation_refs": []
        }
      ],
      "output_documents": [
        "Inventario documental inicial"
      ],
      "external_system": null,
      "approvals": [],
      "legal_basis": [
        "99999999-9999-4999-8999-999999999999"
      ],
      "citation_refs": [
        "99999999-9999-4999-8999-999999999999"
      ],
      "authority_status": "official_national",
      "jurisdiction": "República de Guatemala",
      "evidence_status": "inferred_for_review",
      "confidence": 0.62,
      "deadline": null,
      "completion_criteria": [
        "La necesidad y los documentos faltantes están registrados sin inventar plazos."
      ],
      "follow_up_cadence": null,
      "risks": [
        "Tratar una categoría de investigación como requisito oficial sin fuente local."
      ],
      "unknowns": [
        "Unidad municipal responsable pendiente de evidencia."
      ]
    }
  ],
  "dependencies": [],
  "decision_gates": [
    {
      "gate_id": "abababab-abab-4bab-8bab-abababababab",
      "step_id": "eeeeeeee-eeee-4eee-8eee-eeeeeeeeeeee",
      "question": "¿Existe una fuente oficial local que defina el siguiente paso?",
      "outcomes": [
        {
          "outcome": "Sí, continuar después de revisión humana.",
          "next_step_id": null
        },
        {
          "outcome": "No, registrar evidencia faltante.",
          "next_step_id": null
        }
      ]
    }
  ],
  "required_documents": [
    {
      "document_requirement_id": "ffffffff-ffff-4fff-8fff-ffffffffffff",
      "name": "Solicitud comunitaria respaldada documentalmente",
      "evidence_status": "missing_evidence",
      "citation_refs": []
    }
  ],
  "outputs": [
    "Workflow draft sujeto a revisión humana"
  ],
  "sources": [
    {
      "source_id": "55555555-5555-4555-8555-555555555555",
      "document_id": "66666666-6666-4666-8666-666666666666",
      "document_version_id": "77777777-7777-4777-8777-777777777777",
      "title": "Código Municipal, Decreto 12-2002",
      "municipality": null,
      "source_jurisdiction": "República de Guatemala",
      "target_jurisdiction": "Municipio de La Antigua Guatemala, Sacatepéquez, Guatemala",
      "authority_status": "official_national",
      "official_source": true,
      "official_for_target_jurisdiction": true,
      "source_url": "https://www.congreso.gob.gt/buscador_decretos/12-2002",
      "content_sha256": "aaaaaaaaaaaaaaaaaaaaaaaaaaaaaaaaaaaaaaaaaaaaaaaaaaaaaaaaaaaaaaaa",
      "status": "ingested",
      "limitations": [
        "La ley nacional no demuestra por sí sola la práctica interna de Antigua Guatemala."
      ]
    }
  ],
  "citations": [
    {
      "citation_id": "99999999-9999-4999-8999-999999999999",
      "source_id": "55555555-5555-4555-8555-555555555555",
      "document_version_id": "77777777-7777-4777-8777-777777777777",
      "section_id": "88888888-8888-4888-8888-888888888888",
      "label": "Código Municipal, disposición sobre competencias municipales",
      "excerpt": "La competencia nacional aplicable debe corroborarse con la práctica y documentación municipal.",
      "source_url": "https://www.congreso.gob.gt/buscador_decretos/12-2002",
      "page_start": 1,
      "page_end": 1,
      "authority_status": "official_national",
      "jurisdiction": "República de Guatemala",
      "evidence_status": "supported"
    }
  ],
  "gaps": [
    {
      "gap_id": "12121212-1212-4121-8121-121212121212",
      "description": "Documento o regla pendiente de localizar y validar.",
      "severity": "blocking",
      "next_documental_action": "Localizar el manual o expediente oficial de Antigua Guatemala."
    }
  ],
  "limitations": [
    "Borrador generado por IA; no está aprobado y no contiene estrategia electoral."
  ],
  "provenance": {
    "source_product": "la_muni_rag",
    "generated_by": "ai",
    "created_at": "2026-07-18T18:00:00Z",
    "source_refs": [
      "gt-codigo-municipal-index"
    ],
    "credential_id": "33333333-3333-4333-8333-333333333333",
    "audit_id": "44444444-4444-4444-8444-444444444444"
  }
}
